original_title,genres,overview,release_date,vote_average
The Lovely Bones,Fantasy Drama,"After being brutally murdered, 14-year-old Susie Salmon watches from heaven over her grief-stricken family -- and her killer. As she observes their daily lives, she must balance her thirst for revenge with her desire for her family to heal.",2009-12-26,6.6
Finding Nemo,Animation Family,"Nemo, an adventurous young clownfish, is unexpectedly taken from his Great Barrier Reef home to a dentist's office aquarium. It's up to his worrisome father Marlin and a friendly but forgetful fish Dory to bring Nemo home -- meeting vegetarian sharks, surfer dude turtles, hypnotic jellyfish, hungry seagulls, and more along the way.",2003-05-30,7.6
The Lord of the Rings: The Return of the King,Adventure Fantasy Action,"Aragorn is revealed as the heir to the ancient kings as he, Gandalf and the other members of the broken fellowship struggle to save Gondor from Sauron's forces. Meanwhile, Frodo and Sam bring the ring closer to the heart of Mordor, the dark lord's realm.",2003-12-01,8.1
The Lord of the Rings: The Two Towers,Adventure Fantasy Action,"Frodo and Sam are trekking to Mordor to destroy the One Ring of Power while Gimli, Legolas and Aragorn search for the orc-captured Merry and Pippin. All along, nefarious wizard Saruman awaits the Fellowship members at the Orthanc Tower in Isengard.",2002-12-18,8.0
Seventh Son,Adventure Fantasy,"John Gregory, who is a seventh son of a seventh son and also the local spook, has protected the country from witches, boggarts, ghouls and all manner of things that go bump in the night. However John is not young anymore, and has been seeking an apprentice to carry on his trade. Most have failed to survive. The last hope is a young farmer's son named Thomas Ward. Will he survive the training to become the spook that so many others couldn't?",2014-12-12,5.2
Lara Croft: Tomb Raider,Adventure Fantasy Action Thriller,"English aristocrat Lara Croft is skilled in hand-to-hand combat and in the middle of a battle with a secret society. The shapely archaeologist moonlights as a tomb raider to recover lost antiquities and meets her match in the evil Powell, who's in search of a powerful relic.",2001-06-11,5.7
Transcendence,Thriller Science Fiction Drama Mystery,"Two leading computer scientists work toward their goal of Technological Singularity,  as a radical anti-technology organization fights to prevent them from creating a world where computers can transcend the abilities of the human brain.",2014-04-16,5.9
Jurassic Park III,Adventure Action Thriller Science Fiction,"In need of funds for research, Dr. Alan Grant accepts a large sum of money to accompany Paul and Amanda Kirby on an aerial tour of the infamous Isla Sorna. It isn't long before all hell breaks loose and the stranded wayfarers must fight for survival as a host of new -- and even more deadly -- dinosaurs try to make snacks of them.",2001-07-18,5.7
Rise of the Planet of the Apes,Thriller Action Drama Science Fiction,"Scientist Will Rodman is determined to find a cure for Alzheimer's, the disease which has slowly consumed his father. Will feels certain he is close to a breakthrough and tests his latest serum on apes, noticing dramatic increases in intelligence and brain activity in the primate subjects – especially Caesar, his pet chimpanzee.",2011-08-03,7.0
The Spiderwick Chronicles,Adventure Family Fantasy,"Upon moving into the run-down Spiderwick Estate with their mother, twin brothers Jared and Simon Grace, along with their sister Mallory, find themselves pulled into an alternate world full of faeries and other creatures.",2008-02-14,6.3
A Good Day to Die Hard,Action Thriller,"Iconoclastic, take-no-prisoners cop John McClane, finds himself for the first time on foreign soil after traveling to Moscow to help his wayward son Jack - unaware that Jack is really a highly-trained CIA operative out to stop a nuclear weapons heist. With the Russian underworld in pursuit, and battling a countdown to war, the two McClanes discover that their opposing methods make them unstoppable heroes.",2013-02-06,5.2
The Alamo,Western History War,"Based on the 1836 standoff between a group of Texan and Tejano men, led by Davy Crockett and Jim Bowie, and Mexican dictator Santa Anna's forces at the Alamo in San Antonio, Texas.",2004-04-07,5.8
The Incredibles,Action Adventure Animation Family,"Bob Parr has given up his superhero days to log in time as an insurance adjuster and raise his three children with his formerly heroic wife in suburbia. But when he receives a mysterious assignment, it's time to get back into costume.",2004-11-05,7.4
Cutthroat Island,Action Adventure,"Morgan Adams and her slave, William Shaw, are on a quest to recover the three portions of a treasure map. Unfortunately, the final portion is held by her murderous uncle, Dawg. Her crew is skeptical of her leadership abilities, so she must complete her quest before they mutiny against her. This is made yet more difficult by the efforts of the British crown to end her pirate raids.",1995-12-22,5.7
Percy Jackson & the Olympians: The Lightning Thief,Adventure Fantasy Family,"Accident prone teenager, Percy discovers he's actually a demi-God, the son of Poseidon, and he is needed when Zeus' lightning is stolen. Percy must master his new found skills in order to prevent a war between the Gods that could devastate the entire world.",2010-02-01,6.0
Men in Black,Action Adventure Comedy Science Fiction,"Men in Black follows the exploits of agents Kay and Jay, members of a top-secret organization established to monitor and police alien activity on Earth. The two Men in Black find themselves in the middle of the deadly plot by an intergalactic terrorist who has arrived on Earth to assassinate two ambassadors from opposing galaxies. In order to prevent worlds from colliding, the MiB must track down the terrorist and prevent the destruction of Earth. It's just another typical day for the Men in Black.",1997-07-02,6.9
Toy Story 2,Animation Comedy Family,"Andy heads off to Cowboy Camp, leaving his toys to their own devices. Things shift into high gear when an obsessive toy collector named Al McWhiggen, owner of Al's Toy Barn kidnaps Woody. Andy's toys mount a daring rescue mission, Buzz Lightyear meets his match and Woody has to decide where he and his heart truly belong.",1999-10-30,7.3
Unstoppable,Action Thriller,"A runaway train, transporting deadly, toxic chemicals, is barreling down on Stanton, Pennsylvania, and only two men can stop it: a veteran engineer and a young conductor. Thousands of lives hang in the balance as these ordinary heroes attempt to chase down one million tons of hurtling steel and prevent an epic disaster.",2010-11-04,6.3
Rush Hour 2,Action Comedy Crime Thriller,"It's vacation time for Carter as he finds himself alongside Lee in Hong Kong wishing for more excitement. While Carter wants to party and meet the ladies, Lee is out to track down a Triad gang lord who may be responsible for killing two men at the American Embassy. Things get complicated as the pair stumble onto a counterfeiting plot. The boys are soon up to their necks in fist fights and life-threatening situations. A trip back to the U.S. may provide the answers about the bombing, the counterfeiting, and the true allegiance of sexy customs agent Isabella.",2001-08-03,6.4
What Lies Beneath,Drama Horror Mystery Thriller,"When Claire Spencer starts hearing ghostly voices and seeing spooky images, she wonders if an otherworldly spirit is trying to contact her. All the while, her husband tries to reassure her by telling her it's all in her head. But as Claire investigates, she discovers that the man she loves might know more than he's letting on.",2000-07-21,6.3
Cloudy with a Chance of Meatballs,Animation Comedy Family,"Inventor Flint Lockwood creates a machine that makes clouds rain food, enabling the down-and-out citizens of Chewandswallow to feed themselves. But when the falling food reaches gargantuan proportions, Flint must scramble to avert disaster. Can he regain control of the machine and put an end to the wild weather before the town is destroyed?",2009-09-17,6.5
Ice Age: Dawn of the Dinosaurs,Animation Comedy Family Adventure,"Times are changing for Manny the moody mammoth, Sid the motor mouthed sloth and Diego the crafty saber-toothed tiger. Life heats up for our heroes when they meet some new and none-too-friendly neighbors – the mighty dinosaurs.",2009-06-29,6.5
The Secret Life of Walter Mitty,Adventure Comedy Drama Fantasy,A timid magazine photo manager who lives life vicariously through daydreams embarks on a true-life adventure when a negative goes missing.,2013-12-18,7.0
Charlie's Angels,Action Adventure Comedy Crime Thriller,"Aspects of this take on the 1970s hit TV series are similar to the original show :Angels Dylan, Natalie and Alex still work for Charlie and interface with Bosley. They still flip their hair, stop traffic with a smile and kick butt. The differences are the unsubtle humor, the martial arts training and the high-tech premise: This time, they're hot on the trail of stolen software.",2000-11-02,5.6
The Departed,Drama Thriller Crime,"To take down South Boston's Irish Mafia, the police send in one of their own to infiltrate the underworld, not realizing the syndicate has done likewise. While an undercover cop curries favor with the mob kingpin, a career criminal rises through the police ranks. But both sides soon discover there's a mole among them.",2006-10-05,7.9
Mulan,Animation Family Adventure,"A tomboyish girl disguises herself as a young man so she can fight with the Imperial Chinese Army against the invading Huns. With help from wise-cracking dragon Mushu, Mulan just might save her country -- and win the heart of handsome Captain Li Shang.",1998-06-18,7.6
Tropic Thunder,Action Comedy,"Vietnam veteran 'Four Leaf' Tayback's memoir, Tropic Thunder, is being made into a film, but Director Damien Cockburn can’t control the cast of prima donnas. Behind schedule and over budget, Cockburn is ordered by a studio executive to get filming back on track, or risk its cancellation. On Tayback's advice, Cockburn drops the actors into the middle of the jungle to film the remaining scenes but, unbeknownst to the actors and production, the group have been dropped in the middle of the Golden Triangle, the home of heroin-producing gangs.",2008-08-09,6.5
The Girl with the Dragon Tattoo,Thriller Crime Mystery Drama,"This English-language adaptation of the Swedish novel by Stieg Larsson follows a disgraced journalist, Mikael Blomkvist, as he investigates the disappearance of a weary patriarch's niece from 40 years ago. He is aided by the pierced, tattooed, punk computer hacker named Lisbeth Salander. As they work together in the investigation, Blomkvist and Salander uncover immense corruption beyond anything they have ever imagined.",2011-12-14,7.2
Die Hard: With a Vengeance,Action Thriller,"New York detective John McClane is back and kicking bad-guy butt in the third installment of this action-packed series, which finds him teaming with civilian Zeus Carver to prevent the loss of innocent lives. McClane thought he'd seen it all, until a genius named Simon engages McClane, his new ""partner"" -- and his beloved city -- in a deadly game that demands their concentration.",1995-05-19,6.9
Sherlock Holmes,Action Adventure Crime Mystery,"Eccentric consulting detective, Sherlock Holmes and Doctor John Watson battle to bring down a new nemesis and unravel a deadly plot that could destroy England.",2009-12-23,7.0
Ben-Hur,Drama,A falsely accused nobleman survives years of slavery to take vengeance on his best friend who betrayed him.,2016-08-17,5.3
Atlantis: The Lost Empire,Animation Family Adventure Science Fiction,"The world's most highly qualified crew of archaeologists and explorers is led by historian Milo Thatch as they board the incredible 1,000-foot submarine Ulysses and head deep into the mysteries of the sea.",2001-06-02,6.7
Alvin and the Chipmunks: The Road Chip,Adventure Animation Comedy Family,"Through a series of misunderstandings, Alvin, Simon and Theodore come to believe that Dave is going to propose to his new girlfriend in New York City - and dump them. They have three days to get to him and stop the proposal.",2015-12-17,5.8
Valkyrie,Drama Thriller History War,"Wounded in Africa during World War II, Nazi Col. Claus von Stauffenberg returns to his native Germany and joins the Resistance in a daring plan to create a shadow government and assassinate Adolf Hitler. When events unfold so that he becomes a central player, he finds himself tasked with both leading the coup and personally killing the Führer.",2008-12-25,6.7
You Don't Mess with the Zohan,Comedy Action,An Israeli counterterrorism soldier with a secretly fabulous ambition to become a Manhattan hairstylist. Zohan's desire runs so deep that he'll do anything -- including faking his own death and going head-to-head with an Arab cab driver -- to make his dreams come true.,2008-06-05,5.5
Pixels,Action Comedy Science Fiction,Video game experts are recruited by the military to fight 1980s-era video game characters who've attacked New York.,2015-07-16,5.6
A.I. Artificial Intelligence,Drama Science Fiction Adventure,"A robotic boy, the first programmed to love, David is adopted as a test case by a Cybertronics employee and his wife. Though he gradually becomes their child, a series of unexpected circumstances make this life impossible for David. Without final acceptance by humans or machines, David embarks on a journey to discover where he truly belongs, uncovering a world in which the line between robot and machine is both vast and profoundly thin.",2001-06-29,6.8
The Haunted Mansion,Thriller Fantasy Comedy Family Mystery,"Workaholic Jim Evers and his wife/business partner, Sara get a call one night from mansion owner, Edward Gracey wants to sell his house. Once the Evers family arrive at the mansion a butler takes them to dine with Gracey. Gracey takes one look at Sara and he thinks she's his lost lover.",2003-11-25,5.2
Contact,Drama Science Fiction Mystery,"Contact is a science fiction film about an encounter with alien intelligence. Based on the novel by Carl Sagan the film starred Jodie Foster as the one chosen scientist who must make some difficult decisions between her beliefs, the truth, and reality.",1997-07-11,7.2
Hollow Man,Action Science Fiction Thriller,"Cocky researcher, Sebastian Caine is working on a project to make living creatures invisible and he's so confident he's found the right formula that he tests it on himself and soon begins to vanish. The only problem is – no-one can determine how to make him visible again. Caine's predicament eventually drives him mad, with terrifying results.",2000-08-04,5.6
The Interpreter,Crime Thriller,"After Silvia Broome, an interpreter at United Nations headquarters, overhears plans of an assassination, an American Secret Service agent is sent to investigate.",2005-04-08,6.2
Percy Jackson: Sea of Monsters,Adventure Family Fantasy,"In their quest to confront the ultimate evil, Percy and his friends battle swarms of mythical creatures to find the mythical Golden Fleece and to stop an ancient evil from rising.",2013-08-07,5.9
Lara Croft Tomb Raider: The Cradle of Life,Action Adventure Fantasy Thriller,"Lara Croft ventures to an underwater temple in search of the mythological Pandora's Box but, after securing it, it is promptly stolen by the villainous leader of a Chinese crime syndicate. Lara must recover the box before the syndicate's evil mastermind uses it to construct a weapon of catastrophic capabilities.",2003-07-21,5.5
Now You See Me 2,Action Adventure Comedy Crime Mystery,"One year after outwitting the FBI and winning the public’s adulation with their mind-bending spectacles, the Four Horsemen resurface only to find themselves face to face with a new enemy who enlists them to pull off their most dangerous heist yet.",2016-06-02,6.7
The Saint,Thriller Action Romance Science Fiction Adventure,"Ivan Tretiak, Russian Mafia boss who wants to create an oil crisis in Moscow and seize power as a result sends Simon Templar, great international criminal, to England to get a secret formula for cold fusion from U.S. scientist Emma Russell. Templar falls in love with Emma and they try to outwit Tretiak and his guerrillas, hiding from them in Moscow",1997-04-03,5.9
Spy Game,Action Crime Thriller,"Veteran spy Nathan Muir is on the verge of retiring from the CIA when he learns that his one-time protégé and close friend, Tom Bishop, is a political prisoner sentenced to die in Beijing. Although their friendship has been marred by bad blood and resentment, Muir agrees to take on the most dangerous mission of his career and rescue Bishop.",2001-11-18,6.8
Mission to Mars,Science Fiction,"When contact is lost with the crew of the first Mars expedition, a rescue mission is launched to discover their fate.",2000-03-10,5.7
Rio,Animation Adventure Comedy Family,"Captured by smugglers when he was just a hatchling, a macaw named Blu never learned to fly and lives a happily domesticated life in Minnesota with his human friend, Linda. Blu is thought to be the last of his kind, but when word comes that Jewel, a lone female, lives in Rio de Janeiro, Blu and Linda go to meet her. Animal smugglers kidnap Blu and Jewel, but the pair soon escape and begin a perilous adventure back to freedom -- and Linda.",2011-04-03,6.5
Bicentennial Man,Comedy Science Fiction,"Richard Martin buys a gift, a new NDR-114 robot. The product is named Andrew by the youngest of the family's children. ""Bicentennial Man"" follows the life and times of Andrew, a robot purchased as a household appliance programmed to perform menial tasks. As Andrew begins to experience emotions and creative thought, the Martin family soon discovers they don't have an ordinary robot.",1999-12-17,6.9
Volcano,Science Fiction Action Drama Thriller,"An earthquake shatters a peaceful Los Angeles morning and opens a fissure deep into the earth, causing lava to start bubbling up. As a volcano begins forming in the La Brea Tar Pits, the director of the city's emergency management service, Mike Roark, working with geologist Amy Barnes, must then use every resource in the city to try and stop the volcano from consuming Los Angeles.",1997-04-25,5.2
The Devil's Own,Crime Thriller Drama,"Frankie McGuire, one of the IRA's deadliest assassins, draws an American family into the crossfire of terrorism. But when he is sent to the U.S. to buy weapons, Frankie is housed with the family of Tom O'Meara, a New York cop who knows nothing about Frankie's real identity. Their surprising friendship, and Tom's growing suspicions, forces Frankie to choose between the promise of peace or a lifetime of murder.",1997-03-12,5.9
K-19: The Widowmaker,Drama History Thriller,"When Russia's first nuclear submarine malfunctions on its maiden voyage, the crew must race to save the ship and prevent a nuclear disaster.",2002-07-19,6.1
Conan the Barbarian,Adventure Fantasy Action,"A film adaptation of the classic sword and sorcery hero, Conan the Barbarian. A horde of rampaging warriors massacre the parents of young Conan and enslave the young child for years on The Wheel of Pain. As the sole survivor of the childhood massacre, Conan is released from slavery and taught the ancient arts of fighting. Transforming himself into a killing machine, Conan travels into the wilderness to seek vengeance on Thulsa Doom, the man responsible for killing his family. In the wilderness, Conan takes up with the thieves Valeria and Subotai. The group comes upon King Osric, who wants the trio of warriors to help rescue his daughter who has joined Doom in the hills.",1982-04-02,6.6
Cinderella Man,Romance Drama History,"The true story of boxer, Jim Braddock who, in the 1920’s after his retirement, has a surprise comeback in order to get him and his family out of a socially poor state.",2005-06-02,7.3
The Nutcracker: The Untold Story,Fantasy Action Family,"Set in 1920's Vienna, this a tale of a little girl, whose godfather gives her a special doll one Christmas Eve.",2010-11-24,5.4
Seabiscuit,Drama History,True story of the undersized Depression-era racehorse whose victories lifted not only the spirits of the team behind it but also those of their nation.,2003-07-22,6.7
Twister,Action Adventure Drama,"TV weatherman Bill Harding is trying to get his tornado-hunter wife, Jo, to sign divorce papers so he can marry his girlfriend Melissa. But Mother Nature, in the form of a series of intense storms sweeping across Oklahoma, has other plans. Soon the three have joined the team of stormchasers as they attempt to insert a revolutionary measuring device into the very heart of several extremely violent tornados.",1996-05-10,6.1
Cast Away,Adventure Drama,"Chuck, a top international manager for FedEx, and Kelly, a Ph.D. student, are in love and heading towards marriage. Then Chuck's plane to Malaysia ditches at sea during a terrible storm. He's the only survivor, and he washes up on a tiny island with nothing but some flotsam and jetsam from the aircraft's cargo.",2000-12-22,7.5
Happy Feet,Animation Comedy,"Into the world of the Emperor Penguins, who find their soul mates through song, a penguin is born who cannot sing. But he can tap dance something fierce!",2006-11-16,5.9
The Bourne Supremacy,Action Drama Thriller,"When a CIA operation to purchase classified Russian documents is blown by a rival agent, who then shows up in the sleepy seaside village where Bourne and Marie have been living. The pair run for their lives and Bourne, who promised retaliation should anyone from his former life attempt contact, is forced to once again take up his life as a trained assassin to survive.",2004-07-23,7.2
Air Force One,Action Thriller,"Russian terrorists conspire to hijack the aircraft with the president and his family on board. The commander in chief finds himself facing an impossible predicament: give in to the terrorists and sacrifice his family, or risk everything to uphold his principles - and the integrity of the nation.",1997-07-25,6.2
Ocean's Eleven,Thriller Crime,"Less than 24 hours into his parole, charismatic thief Danny Ocean is already rolling out his next plan: In one night, Danny's hand-picked crew of specialists will attempt to steal more than $150 million from three Las Vegas casinos. But to score the cash, Danny risks his chances of reconciling with ex-wife, Tess.",2001-12-07,7.2
The Three Musketeers,Adventure Action Thriller,The hot-headed young D'Artagnan along with three former legendary but now down on their luck Musketeers must unite and defeat a beautiful double agent and her villainous employer from seizing the French throne and engulfing Europe in war.,2011-08-31,5.6
Hotel Transylvania,Animation Comedy Family Fantasy,"Dracula, who operates a high-end resort away from the human world, goes into overprotective mode when a boy discovers the resort and falls for the count's teen-aged daughter.",2012-09-20,6.8
Enchanted,Comedy Family Fantasy Romance,"The beautiful princess Giselle is banished by an evil queen from her magical, musical animated land and finds herself in the gritty reality of the streets of modern-day Manhattan. Shocked by this strange new environment that doesn't operate on a ""happily ever after"" basis, Giselle is now adrift in a chaotic world badly in need of enchantment. But when Giselle begins to fall in love with a charmingly flawed divorce lawyer who has come to her aid - even though she is already promised to a perfect fairy tale prince back home - she has to wonder: Can a storybook view of romance survive in the real world?",2007-11-20,6.6
Safe House,Action Thriller,"A dangerous CIA renegade resurfaces after a decade on the run. When the safe house he's remanded to is attacked by mercenaries, a rookie operative escapes with him. Now, the unlikely allies must stay alive long enough to uncover who wants them dead.",2012-02-09,6.3
102 Dalmatians,Comedy Family,"Get ready for a howling good time as an all new assortment of irresistible animal heroes are unleashed in this great family tail! In an unlikely alliance, the outrageous Waddlesworth... a parrot who thinks he's a Rottweiler... teams up with Oddball... an un-marked Dalmation puppy eager to earn her spots! Together they embark on a laugh-packed quest to outwit the ever-scheming Cruella De Vil",2000-10-07,5.1
Tower Heist,Action Comedy,"A luxury condo manager leads a staff of workers to seek payback on the Wall Street swindler who defrauded them. With only days until the billionaire gets away with the perfect crime, the unlikely crew of amateur thieves enlists the help of petty crook Slide to steal the $20 million they’re sure is hidden in the penthouse.",2011-11-02,5.8
The Holiday,Comedy Romance,"Two women, one (Cameron Diaz) from America and one (Kate Winslet) from Britain, swap homes at Christmastime after bad breakups with their boyfriends. Each woman finds romance with a local man (Jude Law, Jack Black) but realizes that the imminent return home may end the relationship.",2006-12-08,6.7
Enemy of the State,Action Drama Thriller,"Hotshot Washington lawyer, Robert Dean becomes a victim of high-tech identity theft when a hacker slips an incriminating video into his pocket. Soon, a rogue National Security agent sets out to recover the tape – and destroy Dean.",1998-11-20,6.7
It's Complicated,Comedy Romance,"Ten years after their divorce, Jane and Jake Adler unite for their son's college graduation and unexpectedly end up sleeping together. But Jake is married, and Jane is embarking on a new romance with her architect. Now, she has to sort out her life – just when she thought she had it all figured out.",2009-12-23,6.2
