original_title,genres,overview,release_date,vote_average
Thor: The Dark World,Action Adventure Fantasy,"Thor fights to restore order across the cosmos… but an ancient race led by the vengeful Malekith returns to plunge the universe back into darkness. Faced with an enemy that even Odin and Asgard cannot withstand, Thor must embark on his most perilous and personal journey yet, one that will reunite him with Jane Foster and force him to sacrifice everything to save us all.",2013-10-29,6.8
Mad Max: Fury Road,Action Adventure Science Fiction Thriller,"An apocalyptic story set in the furthest reaches of our planet, in a stark desert landscape where humanity is broken, and most everyone is crazed fighting for the necessities of life. Within this world exist two rebels on the run who just might be able to restore order. There's Max, a man of action and a man of few words, who seeks peace of mind following the loss of his wife and child in the aftermath of the chaos. And Furiosa, a woman of action and a woman who believes her path to survival may be achieved if she can make it across the desert back to her childhood homeland.",2015-05-13,7.2
Angels & Demons,Thriller Mystery,"Harvard symbologist Robert Langdon investigates a mysterious symbol seared into the chest of a murdered physicist. He discovers evidence of the unimaginable, the rebirth of an ancient secret brotherhood known as the Illuminati, the most powerful underground organization ever to walk the earth.",2009-05-13,6.5
Thor,Adventure Fantasy Action,"Against his father Odin's will, The Mighty Thor - a powerful but arrogant warrior god - recklessly reignites an ancient war. Thor is cast down to Earth and forced to live among humans as punishment. Once here, Thor learns what it takes to be a true hero when the most dangerous villain of his world sends the darkest forces of Asgard to invade Earth.",2011-04-21,6.6
Bolt,Animation Family Adventure Comedy,"Bolt is the star of the biggest show in Hollywood. The only problem is, he thinks it's real. After he's accidentally shipped to New York City and separated from Penny, his beloved co-star and owner, Bolt must harness all his ""super powers"" to find a way home.",2008-11-21,6.3
G-Force,Fantasy Action Adventure Family Comedy,"A team of trained secret agent animals, guinea pigs Darwin, Juarez, Blaster, mole Speckles, and fly Mooch takes on a mission for the US government to stop evil Leonard Saber, who plans to destroy the world with household appliances. But the government shuts them down and they are sentenced to a pet shop. Can they escape to defeat the villain and save the world?",2009-07-21,5.1
Wrath of the Titans,Adventure,"A decade after his heroic defeat of the monstrous Kraken, Perseus-the demigod son of Zeus-is attempting to live a quieter life as a village fisherman and the sole parent to his 10-year old son, Helius. Meanwhile, a struggle for supremacy rages between the gods and the Titans. Dangerously weakened by humanity's lack of devotion, the gods are losing control of the imprisoned Titans and their ferocious leader, Kronos, father of the long-ruling brothers Zeus, Hades and Poseidon.",2012-03-27,5.5
Dark Shadows,Comedy Fantasy,Vampire Barnabas Collins is inadvertently freed from his tomb and emerges into the very changed world of 1972. He returns to Collinwood Manor to find that his once-grand estate and family have fallen into ruin.,2012-05-08,5.7
Mission: Impossible - Rogue Nation,Action Adventure Thriller,"Ethan and team take on their most impossible mission yet, eradicating the Syndicate - an International rogue organization as highly skilled as they are, committed to destroying the IMF.",2015-07-23,7.1
The Wolfman,Drama Horror Thriller,"Lawrence Talbot, an American man on a visit to Victorian London to make amends with his estranged father, gets bitten by a werewolf and, after a moonlight transformation, leaves him with a savage hunger for flesh.",2010-02-11,5.5
Bee Movie,Family Animation Adventure Comedy,"Barry B. Benson, a bee who has just graduated from college, is disillusioned at his lone career choice: making honey. On a special trip outside the hive, Barry's life is saved by Vanessa, a florist in New York City. As their relationship blossoms, he discovers humans actually eat honey, and subsequently decides to sue us.",2007-10-28,5.7
Kung Fu Panda 2,Animation Family,"Po is now living his dream as The Dragon Warrior, protecting the Valley of Peace alongside his friends and fellow kung fu masters, The Furious Five - Tigress, Crane, Mantis, Viper and Monkey. But Po’s new life of awesomeness is threatened by the emergence of a formidable villain, who plans to use a secret, unstoppable weapon to conquer China and destroy kung fu. It is up to Po and The Furious Five to journey across China to face this threat and vanquish it. But how can Po stop a weapon that can stop kung fu? He must look to his past and uncover the secrets of his mysterious origins; only then will he be able to unlock the strength he needs to succeed.",2011-05-25,6.7
The Last Airbender,Action Adventure Family Fantasy,"The story follows the adventures of Aang, a young successor to a long line of Avatars, who must put his childhood ways aside and stop the Fire Nation from enslaving the Water, Earth and Air nations.",2010-06-30,4.7
Mission: Impossible III,Adventure Action Thriller,"Retired from active duty to train new IMF agents, Ethan Hunt is called back into action to confront sadistic arms dealer, Owen Davian. Hunt must try to protect his girlfriend while working with his new team to complete the mission.",2006-05-03,6.5
White House Down,Action Drama Thriller,"Capitol Policeman John Cale has just been denied his dream job with the Secret Service of protecting President James Sawyer. Not wanting to let down his little girl with the news, he takes her on a tour of the White House, when the complex is overtaken by a heavily armed paramilitary group. Now, with the nation's government falling into chaos and time running out, it's up to Cale to save the president, his daughter, and the country.",2013-06-27,6.4
Mars Needs Moms,Adventure Animation Family,"When Martians suddenly abduct his mom, mischievous Milo rushes to the rescue and discovers why all moms are so special.",2011-03-09,5.5
Flushed Away,Adventure Animation Comedy Family,"London high-society mouse, Roddy is flushed down the toilet by Sid, a common sewer rat. Hang on for a madcap adventure deep in the sewer bowels of Ratropolis, where Roddy meets the resourceful Rita, the rodent-hating Toad and his faithful thugs, Spike and Whitey.",2006-10-22,6.0
Pan,Adventure Family Fantasy,"Living a bleak existence at a London orphanage, 12-year-old Peter finds himself whisked away to the fantastical world of Neverland. Adventure awaits as he meets new friend James Hook and the warrior Tiger Lily. They must band together to save Neverland from the ruthless pirate Blackbeard. Along the way, the rebellious and mischievous boy discovers his true destiny, becoming the hero forever known as Peter Pan.",2015-09-24,5.9
Mr. Peabody & Sherman,Animation Adventure Family,"A young boy and his dog, who happens to have a genius-level IQ, spring into action when their time-travel machine is stolen and moments in history begin to be changed.",2014-02-07,6.7
Troy,Adventure Drama War,"In year 1250 B.C. during the late Bronze age, two emerging nations begin to clash. Paris, the Trojan prince, convinces Helen, Queen of Sparta, to leave her husband Menelaus, and sail with him back to Troy. After Menelaus finds out that his wife was taken by the Trojans, he asks his brother Agamemnom to help him get her back. Agamemnon sees this as an opportunity for power. So they set off with 1,000 ships holding 50,000 Greeks to Troy. With the help of Achilles, the Greeks are able to fight the never before defeated Trojans.",2004-05-13,6.9
Madagascar 3: Europe's Most Wanted,Animation Family,"Alex, Marty, Gloria and Melman are still trying to get back to the Big Apple and their beloved Central Park zoo, but first they need to find the penguins. When they travel to Monte Carlo, they attract the attention of Animal Control after gate crashing a party and are joined by the penguins, King Julian and Co., and the monkeys. How do a lion, zebra, hippo, giraffe, four penguins, two monkeys, three lemurs travel through Europe without attracting attention and get back to New York? They join a traveling circus. Their attempts to get back to New York are consistently hampered by the Captain of Animal Control who wants to make Alex part of her collection. Once they make it back to New York Marty, Alex, Gloria and Melman realize that they want to be part of the traveling circus.",2012-06-06,6.4
Die Another Day,Adventure Action Thriller,"Bond takes on a North Korean leader who undergoes DNA replacement procedures that allow him to assume different identities. American agent, Jinx Johnson assists Bond in his attempt to thwart the villain's plans to exploit a satellite that is powered by solar energy.",2002-11-17,5.8
Ghostbusters,Action Fantasy Comedy,"Following a ghost invasion of Manhattan, paranormal enthusiasts Erin Gilbert and Abby Yates, nuclear engineer Jillian Holtzmann, and subway worker Patty Tolan band together to stop the otherworldly threat.",2016-07-14,5.3
Armageddon,Action Thriller Science Fiction Adventure,"When an asteroid threatens to collide with Earth, NASA honcho Dan Truman determines the only way to stop it is to drill into its surface and detonate a nuclear bomb. This leads him to renowned driller Harry Stamper, who agrees to helm the dangerous space mission provided he can bring along his own hotshot crew. Among them is the cocksure A.J. who Harry thinks isn't good enough for his daughter, until the mission proves otherwise.",1998-07-01,6.4
Men in Black II,Action Adventure Comedy Science Fiction,"Kay and Jay reunite to provide our best, last and only line of defense against a sinister seductress who levels the toughest challenge yet to the MIB's untarnished mission statement – protecting Earth from the scum of the universe. It's been four years since the alien-seeking agents averted an intergalactic disaster of epic proportions. Now it's a race against the clock as Jay must convince Kay – who not only has absolutely no memory of his time spent with the MIB, but is also the only living person left with the expertise to save the galaxy – to reunite with the MIB before the earth submits to ultimate destruction.",2002-07-03,6.0
Beowulf,Adventure Action Animation,"6th-century Scandinavian warrior, Beowulf embarks on a mission to slay the manlike ogre Grendel, a descendant of Cain.",2007-11-05,5.5
Kung Fu Panda 3,Action Adventure Animation Comedy Family,"Continuing his ""legendary adventures of awesomeness"", Po must face two hugely epic, but different threats: one supernatural and the other a little closer to his home.",2016-01-23,6.7
Mission: Impossible - Ghost Protocol,Action Thriller Adventure,"In the 4th installment of the Mission Impossible series, Ethan Hunt (Cruise) and his team are racing against time to track down a dangerous terrorist named Hendricks (Nyqvist), who has gained access to Russian nuclear launch codes and is planning a strike on the United States. An attempt to stop him ends in an explosion causing severe destruction to the Kremlin and the IMF to be implicated in the bombing, forcing the President to disavow them. No longer being aided by the government, Ethan and his team chase Hendricks around the globe, although they might still be too late to stop a disaster.",2011-12-07,6.8
Rise of the Guardians,Fantasy Animation Family,"When an evil spirit known as Pitch lays down the gauntlet to take over the world, the immortal Guardians must join forces for the first time to protect the hopes, beliefs and imagination of children all over the world.",2012-11-21,7.1
Fun with Dick and Jane,Comedy,"After Dick Harper loses his job at Globodyne in an Enron-esque collapse, he and his wife, Jane, turn to crime in order to handle the massive debt they now face. Two intelligent people, Dick and Jane actually get pretty good at robbing people and even enjoy it -- but they have second thoughts when they're reminded that crime can hurt innocent people. When the couple hears that Globodyne boss Jack McCallister actually swindled the company, they plot revenge.",2005-12-21,5.9
The Last Samurai,Drama Action War History,"Nathan Algren is an American hired to instruct the Japanese army in the ways of modern warfare, which finds him learning to respect the samurai and the honorable principles that rule them. Pressed to destroy the samurai's way of life in the name of modernization and open trade, Algren decides to become an ultimate warrior himself and to fight for their right to exist.",2003-12-05,7.3
Exodus: Gods and Kings,Adventure Drama Action,"The defiant leader Moses rises up against the Egyptian Pharaoh Ramses, setting 400,000 slaves on a monumental journey of escape from Egypt and its terrifying cycle of deadly plagues.",2014-12-03,5.6
Star Trek,Science Fiction Action Adventure,"The fate of the galaxy rests in the hands of bitter rivals. One, James Kirk, is a delinquent, thrill-seeking Iowa farm boy. The other, Spock, a Vulcan, was raised in a logic-based society that rejects all emotion. As fiery instinct clashes with calm reason, their unlikely but powerful partnership is the only thing capable of leading their crew through unimaginable danger, boldly going where no one has gone before. The human adventure has begun again.",2009-05-06,7.4
Spider-Man,Fantasy Action,"After being bitten by a genetically altered spider, nerdy high school student Peter Parker is endowed with amazing powers.",2002-05-01,6.8
How to Train Your Dragon 2,Fantasy Action Adventure Animation Comedy,"The thrilling second chapter of the epic How To Train Your Dragon trilogy brings back the fantastical world of Hiccup and Toothless five years later. While Astrid, Snotlout and the rest of the gang are challenging each other to dragon races (the island's new favorite contact sport), the now inseparable pair journey through the skies, charting unmapped territories and exploring new worlds. When one of their adventures leads to the discovery of a secret ice cave that is home to hundreds of new wild dragons and the mysterious Dragon Rider, the two friends find themselves at the center of a battle to protect the peace.",2014-06-12,7.6
Gods of Egypt,Fantasy,A common thief joins a mythical god on a quest through Egypt.,2016-02-25,5.3
Stealth,Action,"Deeply ensconced in a top-secret military program, three pilots struggle to bring an artificial intelligence program under control ... before it initiates the next world war.",2005-07-28,4.9
Watchmen,Action Mystery Science Fiction,"In a gritty and alternate 1985 the glory days of costumed vigilantes have been brought to a close by a government crackdown, but after one of the masked veterans is brutally murdered an investigation into the killer is initiated. The reunited heroes set out to prevent their own destruction, but in doing so uncover a sinister plot that puts all of humanity in grave danger.",2009-03-05,7.0
Lethal Weapon 4,Action Adventure Comedy Crime Thriller,"In the combustible action franchise's final installment, maverick detectives Martin Riggs and Roger Murtaugh square off against Asian mobster Wah Sing Ku, who's up to his neck in slave trading and counterfeit currency. With help from gumshoe Leo Getz and smart-aleck rookie cop Lee Butters, Riggs and Murtaugh aim to take down Ku and his gang.",1998-07-10,6.3
Hulk,Drama Action Science Fiction,"Bruce Banner, a genetics researcher with a tragic past, suffers massive radiation exposure in his laboratory that causes him to transform into a raging green monster when he gets angry.",2003-06-19,5.3
G.I. Joe: Retaliation,Adventure Action Science Fiction Thriller,"Framed for crimes against the country, the G.I. Joe team is terminated by Presidential order. This forces the G.I. Joes into not only fighting their mortal enemy Cobra; they are forced to contend with threats from within the government that jeopardize their very existence.",2013-03-26,5.4
Sahara,Action Adventure Comedy Drama Mystery,"Scouring the ocean depths for treasure-laden shipwrecks is business as usual for a thrill-seeking underwater adventurer and his wisecracking buddy. But when these two cross paths with a beautiful doctor, they find themselves on the ultimate treasure hunt.",2005-04-06,5.7
Final Fantasy: The Spirits Within,Adventure Action Animation Fantasy Science Fiction,"Led by a strange dream, scientist Aki Ross struggles to collect the eight spirits in the hope of creating a force powerful enough to protect the planet. With the aid of the Deep Eyes Squadron and her mentor, Dr. Sid, Aki must save the Earth from its darkest hate and unleash the spirits within.",2001-07-02,5.9
Captain America: The First Avenger,Action Adventure Science Fiction,"Predominantly set during World War II, Steve Rogers is a sickly man from Brooklyn who's transformed into super-soldier Captain America to aid in the war effort. Rogers must stop the Red Skull – Adolf Hitler's ruthless head of weaponry, and the leader of an organization that intends to use a mysterious device of untold powers for world domination.",2011-07-22,6.6
The World Is Not Enough,Adventure Action Thriller,"Greed, revenge, world dominance and high-tech terrorism – it's all in a day's work for Bond, who's on a mission to a protect beautiful oil heiress from a notorious terrorist. In a race against time that culminates in a dramatic submarine showdown, Bond works to defuse the international power struggle that has the world's oil supply hanging in the balance.",1999-11-08,6.0
Master and Commander: The Far Side of the World,Adventure,"After an abrupt and violent encounter with a French warship inflicts severe damage upon his ship, a captain of the British Royal Navy begins a chase over two oceans to capture or destroy the enemy, though he must weigh his commitment to duty and ferocious pursuit of glory against the safety of his devoted crew, including the ship's thoughtful surgeon, his best friend.",2003-11-14,6.9
The Twilight Saga: Breaking Dawn - Part 2,Adventure Fantasy Drama Romance,"After the birth of Renesmee, the Cullens gather other vampire clans in order to protect the child from a false allegation that puts the family in front of the Volturi.",2012-11-13,6.1
Happy Feet Two,Animation Comedy Family,"Mumble the penguin has a problem: his son Erik, who is reluctant to dance, encounters The Mighty Sven, a penguin who can fly! Things get worse for Mumble when the world is shaken by powerful forces, causing him to brings together the penguin nations and their allies to set things right.",2011-11-17,5.8
The Incredible Hulk,Science Fiction Action Adventure,"Scientist Bruce Banner scours the planet for an antidote to the unbridled force of rage within him: the Hulk. But when the military masterminds who dream of exploiting his powers force him back to civilization, he finds himself coming face to face with a new, deadly foe.",2008-06-12,6.1
The BFG,Adventure Family Fantasy,"The BFG is no ordinary bone-crunching giant. He is far too nice and jumbly. It's lucky for Sophie that he is. Had she been carried off in the middle of the night by the Bloodbottler, or any of the other giants—rather than the BFG—she would have soon become breakfast. When Sophie hears that the giants are flush-bunking off to England to swollomp a few nice little chiddlers, she decides she must stop them once and for all. And the BFG is going to help her!",2016-06-01,6.0
The Revenant,Western Drama Adventure Thriller,"In the 1820s, a frontiersman, Hugh Glass, sets out on a path of vengeance against those who left him for dead after a bear mauling.",2015-12-25,7.3
Turbo,Animation Family,The tale of an ordinary garden snail who dreams of winning the Indy 500.,2013-07-11,6.1
Rango,Animation Comedy Family Western Adventure,"When Rango, a lost family pet, accidentally winds up in the gritty, gun-slinging town of Dirt, the less-than-courageous lizard suddenly finds he stands out. Welcomed as the last hope the town has been waiting for, new Sheriff Rango is forced to play his new role to the hilt.",2011-03-02,6.6
Penguins of Madagascar,Family Animation Adventure Comedy,"Skipper, Kowalski, Rico and Private join forces with undercover organization The North Wind to stop the villainous Dr. Octavius Brine from destroying the world as we know it.",2014-11-22,6.5
The Bourne Ultimatum,Action Drama Mystery Thriller,"Bourne is brought out of hiding once again by reporter Simon Ross who is trying to unveil Operation Blackbriar, an upgrade to Project Treadstone, in a series of newspaper columns. Information from the reporter stirs a new set of memories, and Bourne must finally uncover his dark past while dodging The Company's best efforts to eradicate him.",2007-08-03,7.3
Kung Fu Panda,Adventure Animation Family Comedy,"When the Valley of Peace is threatened, lazy Po the panda discovers his destiny as the ""chosen one"" and trains to become a kung fu hero, but transforming the unsleek slacker into a brave warrior won't be easy. It's up to Master Shifu and the Furious Five -- Tigress, Crane, Mantis, Viper and Monkey -- to give it a try.",2008-06-04,6.9
Ant-Man,Science Fiction Action Adventure,"Armed with the astonishing ability to shrink in scale but increase in strength, master thief Scott Lang must embrace his inner-hero and help his mentor, Doctor Hank Pym, protect the secret behind his spectacular Ant-Man suit from a new generation of towering threats. Against seemingly insurmountable obstacles, Pym and Lang must plan and pull off a heist that will save the world.",2015-07-14,7.0
The Hunger Games: Catching Fire,Adventure Action Science Fiction,"Katniss Everdeen has returned home safe after winning the 74th Annual Hunger Games along with fellow tribute Peeta Mellark. Winning means that they must turn around and leave their family and close friends, embarking on a ""Victor's Tour"" of the districts. Along the way Katniss senses that a rebellion is simmering, but the Capitol is still very much in control as President Snow prepares the 75th Annual Hunger Games (The Quarter Quell) - a competition that could change Panem forever.",2013-11-15,7.4
Home,Fantasy Comedy Animation Science Fiction Family,"When Earth is taken over by the overly-confident Boov, an alien race in search of a new place to call home, all humans are promptly relocated, while all Boov get busy reorganizing the planet. But when one resourceful girl, Tip, manages to avoid capture, she finds herself the accidental accomplice of a banished Boov named Oh. The two fugitives realize there’s a lot more at stake than intergalactic relations as they embark on the road trip of a lifetime.",2015-03-18,6.8
War of the Worlds,Adventure Thriller Science Fiction,"Ray Ferrier is a divorced dockworker and less-than-perfect father. Soon after his ex-wife and her new husband drop of his teenage son and young daughter for a rare weekend visit, a strange and powerful lightning storm touches down.",2005-06-28,6.2
Bad Boys II,Adventure Action Comedy Thriller Crime,"Out-of-control, trash-talking buddy cops Marcus Burnett and Mike Lowrey of the Miami Narcotics Task Force reunite, and bullets fly, cars crash and laughs explode as they pursue a whacked-out drug lord from the streets of Miami to the barrios of Cuba. But the real fireworks result when Marcus discovers that playboy Mike is secretly romancing Marcus’ sexy sister.",2003-07-18,6.3
Puss in Boots,Action Adventure Animation Family Fantasy,"Long before he even met Shrek, the notorious fighter, lover and outlaw Puss in Boots becomes a hero when he sets off on an adventure with the tough and street smart Kitty Softpaws and the mastermind Humpty Dumpty to save his town. This is the true story of The Cat, The Myth, The Legend... The Boots.",2011-10-28,6.4
Salt,Action Mystery Thriller,"As a CIA officer, Evelyn Salt swore an oath to duty, honor and country. Her loyalty will be tested when a defector accuses her of being a Russian spy. Salt goes on the run, using all her skills and years of experience as a covert operative to elude capture. Salt's efforts to prove her innocence only serve to cast doubt on her motives, as the hunt to uncover the truth behind her identity continues and the question remains: ""Who is Salt?""",2010-07-21,6.2
Noah,Drama Adventure,A man who suffers visions of an apocalyptic deluge takes measures to protect his family from the coming flood.,2014-03-20,5.6
The Adventures of Tintin,Adventure Animation Mystery,"Intrepid young reporter, Tintin and his loyal dog, Snowy are thrust into a world of high adventure when they discover a ship carrying an explosive secret. As Tintin is drawn into a centuries-old mystery, Ivan Ivanovitch Sakharine suspects him of stealing a priceless treasure. Tintin and Snowy, with the help of salty, cantankerous Captain Haddock and bumbling detectives, Thompson &amp; Thomson, travel half the world, one step ahead of their enemies as Tintin endeavors to find The Unicorn, a sunken ship that may hold a vast fortune, but also an ancient curse.",2011-10-25,6.7
Harry Potter and the Prisoner of Azkaban,Adventure Fantasy Family,"Harry, Ron and Hermione return to Hogwarts for another magic-filled year. Harry comes face to face with danger yet again, this time in the form of escaped convict, Sirius Black – and turns to sympathetic Professor Lupin for help.",2004-05-31,7.7
