original_title,genres,overview,release_date,vote_average
Ender's Game,Science Fiction Action Adventure,"Based on the classic novel by Orson Scott Card, Ender's Game is the story of the Earth's most gifted children training to defend their homeplanet in the space wars of the future.",2013-10-23,6.6
Live Free or Die Hard,Action Thriller,"John McClane is back and badder than ever, and this time he's working for Homeland Security. He calls on the services of a young hacker in his bid to stop a ring of Internet terrorists intent on taking control of America's computer infrastructure.",2007-06-20,6.4
The Lord of the Rings: The Fellowship of the Ring,Adventure Fantasy Action,"Young hobbit Frodo Baggins, after inheriting a mysterious ring from his uncle Bilbo, must leave his home in order to keep it from falling into the hands of its evil creator. Along the way, a fellowship is formed to protect the ringbearer and make sure that the ring arrives at its final destination: Mt. Doom, the only place where it can be destroyed.",2001-12-18,8.0
Around the World in 80 Days,Action Adventure Comedy,"A bet pits a British inventor, a Chinese thief and a French artist on a worldwide adventure that they can circle the globe in 80 days.",2004-06-16,5.7
Ali,Drama,"In 1964, a brash new pro boxer, fresh from his olympic gold medal victory, explodes on to the scene; Cassius Clay. Bold and outspoken, he cuts an entirely new image for African Americans in sport with his proud public self confidence and his unapologetic belief that he is the greatest boxer of all time. Yet at the top of his game, both Ali's personal and professional lives face the ultimate test.",2001-12-11,6.7
The Cat in the Hat,Comedy Fantasy Family,"Conrad and Sally Walden are home alone with their pet fish. It is raining outside, and there is nothing to do. Until The Cat in the Hat walks in the front door. He introduces them to their imagination, and at first it's all fun and games, until things get out of hand, and The Cat must go, go, go, before their parents get back.",2003-11-21,4.9
"I, Robot",Action Science Fiction,"In 2035, where robots are common-place and abide by the three laws of robotics, a techno-phobic cop investigates an apparent suicide. Suspecting that a robot may be responsible for the death, his investigation leads him to believe that humanity may be in danger.",2004-07-15,6.7
Kingdom of Heaven,Drama Action Adventure History War,"After his wife dies, a blacksmith named Balian is thrust into royalty, political intrigue and bloody holy wars during the Crusades.",2005-05-03,6.6
Stuart Little,Animation Fantasy Family Comedy,"The adventures of a heroic and debonair stalwart mouse named Stuart Little with human qualities, who faces some comic misadventures while searching for his lost bird friend and living with a human family as their child.",1999-12-17,5.8
The Princess and the Frog,Romance Family Animation Music,"A waitress, desperate to fulfill her dreams as a restaurant owner, is set on a journey to turn a frog prince back into a human being, but she has to do face the same problem after she kisses him.",2009-12-08,6.7
The Martian,Drama Adventure Science Fiction,"During a manned mission to Mars, Astronaut Mark Watney is presumed dead after a fierce storm and left behind by his crew. But Watney has survived and finds himself stranded and alone on the hostile planet. With only meager supplies, he must draw upon his ingenuity, wit and spirit to subsist and find a way to signal to Earth that he is alive.",2015-09-30,7.6
The Island,Action Thriller Science Fiction Adventure,"In 2019, Lincoln Six-Echo is a resident of a seemingly ""Utopian"" but contained facility. Like all of the inhabitants of this carefully-controlled environment, Lincoln hopes to be chosen to go to The Island — reportedly the last uncontaminated location on the planet. But Lincoln soon discovers that everything about his existence is a lie.",2005-07-20,6.5
Town & Country,Comedy Romance,"Porter Stoddard is a well-known New York architect who is at a crossroads... a nexus where twists and turns lead to myriad missteps some with his wife Ellie, others with longtime friends Mona and her husband Griffin. Deciding which direction to take often leads to unexpected encounters with hilarious consequences.",2001-04-27,3.7
Gone in Sixty Seconds,Action Crime Thriller,"Upon learning that he has to come out of retirement to steal 50 cars in one night to save his brother Kip's life, former car thief Randall ""Memphis"" Raines enlists help from a few ""boost happy"" pals to accomplish a seemingly impossible feat. From countless car chases to relentless cops, the high-octane excitement builds as Randall swerves around more than a few roadblocks to keep Kip alive.",2000-06-09,6.1
Gladiator,Action Drama Adventure,"In the year 180, the death of emperor Marcus Aurelius throws the Roman Empire into chaos. Maximus is one of the Roman army's most capable and trusted generals and a key advisor to the emperor. As Marcus' devious son Commodus ascends to the throne, Maximus is set to be executed. He escapes, but is captured by slave traders. Renamed Spaniard and forced to become a gladiator, Maximus must battle to the death with other men for the amusement of paying audiences. His battle skills serve him well, and he becomes one of the most famous and admired men to fight in the Colosseum. Determined to avenge himself against the man who took away his freedom and laid waste to his family, Maximus believes that he can use his fame and skill in the ring to avenge the loss of his family and former glory. As the gladiator begins to challenge his rule, Commodus decides to put his own fighting mettle to the test by squaring off with Maximus in a battle to the death.",2000-05-01,7.9
Minority Report,Action Thriller Science Fiction Mystery,"John Anderton is a top 'Precrime' cop in the late-21st century, when technology can predict crimes before they're committed. But Anderton becomes the quarry when another investigator targets him for a murder charge.",2002-06-20,7.1
Harry Potter and the Chamber of Secrets,Adventure Fantasy Family,"Ignoring threats to his life, Harry returns to Hogwarts to investigate – aided by Ron and Hermione – a mysterious series of attacks.",2002-11-13,7.4
Casino Royale,Adventure Action Thriller,"Le Chiffre, a banker to the world's terrorists, is scheduled to participate in a high-stakes poker game in Montenegro, where he intends to use his winnings to establish his financial grip on the terrorist market. M sends Bond – on his maiden mission as a 00 Agent – to attend this game and prevent Le Chiffre from winning. With the help of Vesper Lynd and Felix Leiter, Bond enters the most important poker game in his already dangerous career.",2006-11-14,7.3
Planet of the Apes,Thriller Science Fiction Action Adventure,"After a spectacular crash-landing on an uncharted planet, brash astronaut Leo Davidson finds himself trapped in a savage world where talking apes dominate the human race. Desperate to find a way home, Leo must evade the invincible gorilla army led by Ruthless General Thade.",2001-07-25,5.6
Terminator 2: Judgment Day,Action Thriller Science Fiction,"Nearly 10 years have passed since Sarah Connor was targeted for termination by a cyborg from the future. Now her son, John, the future leader of the resistance, is the target for a newer, more deadly terminator. Once again, the resistance has managed to send a protector back to attempt to save John and his mother Sarah.",1991-07-01,7.7
Public Enemies,History Crime Drama,"Depression-era bank robber John Dillinger's charm and audacity endear him to much of America's downtrodden public, but he's also a thorn in the side of J. Edgar Hoover and the fledgling FBI. Desperate to capture the elusive outlaw, Hoover makes Dillinger his first Public Enemy Number One and assigns his top agent, Melvin Purvis, the task of bringing him in dead or alive.",2009-07-01,6.5
American Gangster,Drama Crime,"Following the death of his employer and mentor, Bumpy Johnson, Frank Lucas establishes himself as the number one importer of heroin in the Harlem district of Manhattan. He does so by buying heroin directly from the source in South East Asia and he comes up with a unique way of importing the drugs into the United States. Based on a true story.",2007-11-02,7.4
True Lies,Action Thriller,"Harry Tasker is a secret agent for the United States Government. For years, he has kept his job from his wife, but is forced to reveal his identity and try to stop nuclear terrorists when he and his wife are kidnapped by them.",1994-07-14,6.8
The Taking of Pelham 1 2 3,Thriller Drama Crime,"Armed men hijack a New York City subway train, holding the passengers hostage in return for a ransom, and turning an ordinary day's work for dispatcher Walter Garber into a face-off with the mastermind behind the crime.",2009-06-11,6.2
Little Fockers,Comedy Romance,"It has taken 10 years, two little Fockers with wife Pam and countless hurdles for Greg to finally get in with his tightly wound father-in-law, Jack. After the cash-strapped dad takes a job moonlighting for a drug company, Jack's suspicions about his favorite male nurse come roaring back. When Greg and Pam's entire clan descends for the twins' birthday party, Greg must prove to the skeptical Jack that he's fully capable as the man of the house.",2010-12-21,5.4
The Other Guys,Action Comedy Crime,"NYPD detectives Christopher Danson (Johnson) and P.K. Highsmith (Jackson) are the baddest and most beloved cops in New York City. They don't get tattoos, other men get tattoos of them. Two desks over and one back, sit detectives Allen Gamble (Ferrell) and Terry Hoitz (Wahlberg). You've seen them in the background of photos of Danson and Highsmith, out of focus and eyes closed. They're not heroes, they're ""the other guys."" But every cop has his or her day and soon Gamble and Hoitz stumble into a seemingly innocuous case no other detective wants to touch that could turn into NYC's biggest crime. It's the opportunity of their lives, but do these guys have the right stuff?",2010-08-06,6.1
Eraser,Action Drama Mystery Thriller,"U.S. Marshall John Kruger erases the identities of people enrolled in the Witness Protection Program. His current assignment is to protect Lee Cullen, who's uncovered evidence that the weapons manufacturer she works for has been selling to terrorist groups. When Kruger discovers that there's a corrupt agent within the program, he must guard his own life while trying to protect Lee's.",1996-06-21,5.6
Django Unchained,Drama Western,"With the help of a German bounty hunter, a freed slave sets out to rescue his wife from a brutal Mississippi plantation owner.",2012-12-25,7.8
The Hunchback of Notre Dame,Drama Animation Family,"When Quasi defies the evil Frollo and ventures out to the Festival of Fools, the cruel crowd jeers him. Rescued by fellow outcast the gypsy Esmeralda, Quasi soon finds himself battling to save the people and the city he loves.",1996-06-21,6.8
The Emperor's New Groove,Adventure Animation Comedy Family Fantasy,"Kuzco is a self-centered emperor who summons Pacha from a village and to tell him that his home will be destroyed to make room for Kuzco's new summer home. Kuzco's advisor, Yzma, tries to poison Kuzco and accidentally turns him into a llama, who accidentally ends up in Pacha's village. Pacha offers to help Kuzco if he doesn't destroy his house, and so they form an unlikely partnership.",2000-12-09,7.2
The Expendables 2,Action Adventure Thriller,"Mr. Church reunites the Expendables for what should be an easy paycheck, but when one of their men is murdered on the job, their quest for revenge puts them deep in enemy territory and up against an unexpected threat.",2012-08-08,6.1
National Treasure,Adventure Action Thriller Mystery,"Modern treasure hunters, led by archaeologist Ben Gates, search for a chest of riches rumored to have been stashed away by George Washington, Thomas Jefferson and Benjamin Franklin during the Revolutionary War. The chest's whereabouts may lie in secret clues embedded in the Constitution and the Declaration of Independence, and Gates is in a race to find the gold before his enemies do.",2004-11-19,6.4
Eragon,Fantasy Action Adventure Family,"In his homeland of Alagaesia, a farm boy happens upon a dragon's egg -- a discovery that leads him on a predestined journey where he realized he's the one person who can defend his home against an evil king.",2006-12-14,4.9
Where the Wild Things Are,Family Fantasy,"Max imagines running away from his mom and sailing to a far-off land where large talking beasts -- Ira, Carol, Douglas, the Bull, Judith and Alexander -- crown him as their king, play rumpus, build forts and discover secret hideaways.",2009-10-16,6.4
Epic,Animation Adventure Family Fantasy,A teenager finds herself transported to a deep forest setting where a battle between the forces of good and the forces of evil is taking place. She bands together with a rag-tag group characters in order to save their world -- and ours.,2013-05-15,6.4
The Tourist,Action Thriller Romance,"American tourist Frank (Johnny Depp) meets mysterious British woman Elsie (Angelina Jolie) on the train to Venice. Romance seems to bud, but there's more to her than meets the eye. Remake of the 2005 French film ""Anthony Zimmer"", written and directed by Jérôme Salle.",2010-12-08,6.0
End of Days,Action Fantasy Horror Mystery,"On December 28th, 1999, the citizens of New York City are getting ready for the turn of the millennium. However, the Devil decides to crash the party by coming to the city, inhabiting a man's body, and searching for his chosen bride, a 20-year-old woman named Christine York. The world will end, and the only hope lies within an atheist called Jericho Cane.",1999-11-24,5.5
Blood Diamond,Drama Thriller Action,"An ex-mercenary turned smuggler. A Mende fisherman. Amid the explosive civil war overtaking 1999 Sierra Leone, these men join for two desperate missions: recovering a rare pink diamond of immense value and rescuing the fisherman's son conscripted as a child soldier into the brutal rebel forces ripping a swath of torture and bloodshed countrywide.",2006-12-07,7.3
The Wolf of Wall Street,Crime Drama Comedy,"A New York stockbroker refuses to cooperate in a large securities fraud case involving corruption on Wall Street, corporate banking world and mob infiltration. Based on Jordan Belfort's autobiography.",2013-12-25,7.9
Batman Forever,Action Crime Fantasy,"The Dark Knight of Gotham City confronts a dastardly duo: Two-Face and the Riddler. Formerly District Attorney Harvey Dent, Two-Face believes Batman caused the courtroom accident which left him disfigured on one side. And Edward Nygma, computer-genius and former employee of millionaire Bruce Wayne, is out to get the philanthropist; as The Riddler. Former circus acrobat Dick Grayson, his family killed by Two-Face, becomes Wayne's ward and Batman's new partner Robin.",1995-05-31,5.2
Starship Troopers,Adventure Action Thriller Science Fiction,"Set in the future, the story follows a young soldier named Johnny Rico and his exploits in the Mobile Infantry. Rico's military career progresses from recruit to non-commissioned officer and finally to officer against the backdrop of an interstellar war between mankind and an arachnoid species known as ""the Bugs"".",1997-11-06,6.7
Cloud Atlas,Drama Science Fiction,"A set of six nested stories spanning time between the 19th century and a distant post-apocalyptic future. Cloud Atlas explores how the actions and consequences of individual lives impact one another throughout the past, the present and the future. Action, mystery and romance weave through the story as one soul is shaped from a killer into a hero and a single act of kindness ripples across centuries to inspire a revolution in the distant future.  Based on the award winning novel by David Mitchell. Directed by Tom Tykwer and the Wachowskis.",2012-10-26,6.6
Legend of the Guardians: The Owls of Ga'Hoole,Animation Adventure Family Fantasy,"Soren, a young barn owl, is kidnapped by owls of St. Aggie's, ostensibly an orphanage, where owlets are brainwashed into becoming soldiers. He and his new friends escape to the island of Ga'Hoole, to assist its noble, wise owls who fight the army being created by the wicked rulers of St. Aggie's. The film is based on the first three books in the series.",2010-07-10,6.5
Catwoman,Action Crime,"Liquidated after discovering a corporate conspiracy, mild-mannered graphic artist Patience Phillips washes up on an island, where she's resurrected and endowed with the prowess of a cat -- and she's eager to use her new skills ... as a vigilante. Before you can say ""cat and mouse,"" handsome gumshoe Tom Lone is on her tail.",2004-07-22,4.2
Hercules,Action Adventure,"Fourteen hundred years ago, a tormented soul walked the earth that was neither man nor god. Hercules was the powerful son of the god king Zeus, for this he received nothing but suffering his entire life. After twelve arduous labors and the loss of his family, this dark, world-weary soul turned his back on the gods finding his only solace in bloody battle. Over the years he warmed to the company of six similar souls, their only bond being their love of fighting and presence of death. These men and woman never question where they go to fight or why or whom, just how much they will be paid. Now the King of Thrace has hired these mercenaries to train his men to become the greatest army of all time. It is time for this bunch of lost souls to finally have their eyes opened to how far they have fallen when they must train an army to become as ruthless and blood thirsty as their reputation has become.",2014-07-23,5.6
Treasure Planet,Adventure Animation Family Fantasy Science Fiction,"When space galleon cabin boy Jim Hawkins discovers a map to an intergalactic ""loot of a thousand worlds,"" a cyborg cook named John Silver teaches him to battle supernovas and space storms. But, soon, Jim realizes Silver is a pirate intent on mutiny!",2002-11-26,7.2
Land of the Lost,Adventure Comedy Science Fiction,"On his latest expedition, Dr. Rick Marshall is sucked into a space-time vortex alongside his research assistant and a redneck survivalist. In this alternate universe, the trio make friends with a primate named Chaka, their only ally in a world full of dinosaurs and other fantastic creatures.",2009-06-05,5.3
The Expendables 3,Action Adventure Thriller,"Barney, Christmas and the rest of the team comes face-to-face with Conrad Stonebanks, who years ago co-founded The Expendables with Barney. Stonebanks subsequently became a ruthless arms trader and someone who Barney was forced to kill… or so he thought. Stonebanks, who eluded death once before, now is making it his mission to end The Expendables -- but Barney has other plans. Barney decides that he has to fight old blood with new blood, and brings in a new era of Expendables team members, recruiting individuals who are younger, faster and more tech-savvy. The latest mission becomes a clash of classic old-school style versus high-tech expertise in the Expendables’ most personal battle yet.",2014-08-04,6.1
Point Break,Action Crime Thriller,"A young undercover FBI agent infiltrates a gang of thieves who share a common interest in extreme sports. A remake of the 1991 film, ""Point Break"".",2015-12-03,5.5
Son of the Mask,Fantasy Comedy Family Adventure,"Tim Avery, an aspiring cartoonist, finds himself in a predicament when his dog stumbles upon the mask of Loki. Then after conceiving an infant son ""born of the mask"", he discovers just how looney child raising can be.",2005-02-18,3.6
In the Heart of the Sea,Thriller Drama Adventure Action History,"In the winter of 1820, the New England whaling ship Essex was assaulted by something no one could believe: a whale of mammoth size and will, and an almost human sense of vengeance.  The real-life maritime disaster would inspire Herman Melville’s Moby Dick.  But that told only half the story.  “Heart of the Sea” reveals the encounter’s harrowing aftermath, as the ship’s surviving crew is pushed to their limits and forced to do the unthinkable to stay alive.  Braving storms, starvation, panic and despair, the men will call into question their deepest beliefs, from the value of their lives to the morality of their trade, as their captain searches for direction on the open sea and his first mate still seeks to bring the great whale down.",2015-11-20,6.5
The Adventures of Pluto Nash,Action Comedy Science Fiction,"The year is 2087, the setting is the moon. Pluto Nash, the high-flying successful owner of the hottest nightclub in the universe, finds himself in trouble when he refuses to sell his club to lunar gangster Mogan, who just happens to be helping the mysterious Rex Crater mastermind a plan to take over the entire moon.",2002-08-15,4.4
Green Zone,War Action Adventure Drama Thriller,"During the U.S.-led occupation of Baghdad in 2003, Chief Warrant Officer Roy Miller and his team of Army inspectors were dispatched to find weapons of mass destruction believed to be stockpiled in the Iraqi desert. Rocketing from one booby-trapped and treacherous site to the next, the men search for deadly chemical agents but stumble instead upon an elaborate cover-up that threatens to invert the purpose of their mission.",2010-03-11,6.4
The Peanuts Movie,Animation,"Snoopy embarks upon his greatest mission as he and his team take to the skies to pursue their arch-nemesis, while his best pal Charlie Brown begins his own epic quest back home.",2015-11-05,6.5
The Spanish Prisoner,Crime Drama Mystery Thriller,An employee of a corporation with a lucrative secret process is tempted to betray it. But there's more to it than that.,1997-09-08,7.1
The Mummy Returns,Adventure Action Fantasy,"Rick and Evelyn O'Connell, along with their 8 year old son Alex, discover the key to the legendary Scorpion King's might, the fabled Bracelet of Anubis. Unfortunately, a newly resurrected Imhotep has designs on the bracelet as well, and isn't above kidnapping its new bearer, Alex, to gain control of Anubis' otherworldly army.",2001-04-28,6.0
Gangs of New York,Drama History Crime,"It's 1863. America was born in the streets. Amsterdam Vallon returns to the Five Points of America to seek vengeance against the psychotic gangland kingpin, Bill the Butcher, who murdered his father years earlier. With an eager pickpocket by his side and a whole new army, Vallon fights his way to seek vengeance on the Butcher and restore peace in the area.",2002-12-14,7.1
金陵十三釵,Drama History War,"A Westerner finds refuge with a group of women in a church during Japan's rape of Nanking in 1937. Posing as a priest, he attempts to lead the women to safety.",2011-12-15,7.1
Surf's Up,Animation Comedy Family,"Cody is a surfing penguin from Shiverpool who dreams of making it big and being like his idol Big Z. On his journey he discovers his talents are not all he thinks they are and he must learn to accept that their is more to surfing than fame and fortune.  Surf's Up is a 2007 American computer-animated mockumentary film produced by Sony Pictures Animation and distributed by Columbia Pictures and ImageWorks Studios. It stars the voices of Shia LaBeouf, Jeff Bridges, Zooey Deschanel, Jon Heder among others.",2007-06-08,5.9
The Stepford Wives,Action Comedy Science Fiction,"What does it take to become a Stepford wife, a woman perfect beyond belief? Ask the Stepford husbands, who've created this high-tech, terrifying little town.",2004-06-10,5.4
Black Hawk Down,Action History War,"When U.S. Rangers and an elite Delta Force team attempt to kidnap two underlings of a Somali warlord, their Black Hawk helicopters are shot down, and the Americans suffer heavy casualties, facing intense fighting from the militia on the ground.",2001-12-28,7.2
The Campaign,Comedy,Two rival politicians compete to win an election to represent their small North Carolina congressional district in the United States House of Representatives.,2012-08-09,5.6
The Fifth Element,Adventure Fantasy Action Thriller Science Fiction,"In 2257, a taxi driver is unintentionally given the task of saving a young girl who is part of the key that will ensure the survival of humanity.",1997-05-07,7.3
Sex and the City 2,Comedy Drama Romance,"Carrie, Charlotte, and Miranda are all married now, but they're still up for a little fun in the sun. When Samantha gets the chance to visit one of the most extravagant vacation destinations on the planet and offers to bring them all along, they surmise that a women-only retreat may be the perfect excuse to eschew their responsibilities and remember what life was like before they decided to settle down.",2010-05-26,5.4
The Road to El Dorado,Adventure Animation Comedy Family,"After a failed swindle, two con-men end up with a map to El Dorado, the fabled ""city of gold,"" and an unintended trip to the New World.  Much to their surprise, the map does lead the pair to the mythical city, where the startled inhabitants promptly begin to worship them as gods.  The only question is, do they take the worshipful natives for all they're worth, or is there a bit more to El Dorado than riches?",2000-03-31,7.0
Ice Age: Continental Drift,Animation Comedy Adventure Family,"Manny, Diego, and Sid embark upon another adventure after their continent is set adrift. Using an iceberg as a ship, they encounter sea creatures and battle pirates as they explore a new world.",2012-06-26,6.2
Cinderella,Romance Fantasy Family Drama,"When her father unexpectedly passes away, young Ella finds herself at the mercy of her cruel stepmother and her daughters. Never one to give up hope, Ella's fortunes begin to change after meeting a dashing stranger in the woods.",2015-03-12,6.7
